{
  "appModulePath": "apps/api/src/app.module.ts",
  "requiredModules": [],
  "requiredNpmScripts": ["db:migrate", "db:seed"],
  "fixtureEnvVar": "VITE_PREVIEW_FIXTURE_MODE",
  "fixtureHelperPath": "",
  "e2eHarnessPath": "tests/e2e/src/support/create-e2e-app.ts",
  "e2eRequiredModules": [],
  "composeProfiles": [],
  "composeServices": [],
  "jwtEnvVars": [],
  "jwtServicePath": ""
}
